contest_name,managing_authority,election_id,election_name,election_domain_id,election_domain_name,election_date,station_name,station_id,postcode,cast,total_counted,rejected_blanco,rejected_ongeldig,uncounted_andere verklaring,uncounted_geen verklaring,uncounted_geldige kiezerspassen,uncounted_geldige stempassen,uncounted_geldige volmachtbewijzen,uncounted_meegenomen stembiljetten,uncounted_meer getelde stembiljetten,uncounted_minder getelde stembiljetten,uncounted_te veel uitgereikte stembiljetten,uncounted_te weinig uitgereikte stembiljetten,uncounted_toegelaten kiezers,Democraten 66 (D66),CDA - Europese Volkspartij,PVV (Partij voor de Vrijheid),VVD,SP (Socialistische Partij),P.v.d.A./Europese Sociaaldemocraten,ChristenUnie-SGP,GROENLINKS,Partij voor de Dieren,50PLUS,JEZUS LEEFT,DENK,De Groenen,Forum voor Democratie,vandeRegio & Piratenpartij,Volt Nederland
,Beemster,EP2019,Europees Parlement 2019,,,2019-05-23,Stembureau Stembureau Gemeentehuis MB,0370::SB1,1462 NV,1852,929,3,1,0,3,0,831,105,0,0,3,0,0,936,63,103,53,201,22,164,13,85,46,24,0,1,2,134,1,17
,Beemster,EP2019,Europees Parlement 2019,,,2019-05-23,Stembureau Stembureau Dienstencentrum Middelwijck MB,0370::SB2,1462 JN,1793,703,3,1,0,0,1,621,85,0,0,0,0,0,707,44,66,33,156,25,153,14,55,34,25,0,0,0,89,1,8
,Beemster,EP2019,Europees Parlement 2019,,,2019-05-23,Stembureau Stembureau De Kerckhaen WB,0370::SB3,1464 NG,629,353,0,2,0,0,1,301,53,0,0,0,0,0,355,12,70,9,93,2,49,1,26,17,10,0,0,0,57,1,6
,Beemster,EP2019,Europees Parlement 2019,,,2019-05-23,Stembureau Stembureau Buurthuis Zuidoost ZOB,0370::SB4,1461 BW,1295,770,1,2,0,2,7,656,112,0,0,2,0,0,775,51,84,13,239,18,144,13,59,25,16,0,0,0,92,1,15
,Beemster,EP2019,Europees Parlement 2019,,,2019-05-23,Stembureau Stembureau Wooncentrum Zuiderhof ZOB,0370::SB5,1461 AJ,1449,670,1,1,0,0,0,604,68,0,0,0,0,0,672,35,92,27,156,14,143,10,44,36,20,0,0,0,84,1,8
,Beemster,EP2019,Europees Parlement 2019,,,2019-05-23,Stembureau Stembureau De Bonte Klaver NB,0370::SB6,1463 HC,641,288,0,0,0,0,0,251,37,0,0,0,0,0,288,13,43,5,82,1,56,2,17,10,7,0,0,0,42,0,10
